Topic_Mnemonic,Id,Topic_Description,Topic_Description_Welsh,Topic_Title,Topic_Title_Welsh
HSC,1,Data and analysis on the general health and disabilities of the population and the provision of unpaid care.,Data a dadansoddiad ar iechyd cyffredinol ac anableddau'r boblogaeth a darparu gofal di-dâl.,Health and social care,Iechyd a gofal cymdeithasol
MAD,2,"Data and analysis on migration patterns, age structure and families.","Data a dadansoddiad ar batrymau mudo, strwythur oedran a theuluoedd.",Migration and demography,Mudo a demograffeg
EILR,3,"Data and analysis on the ethnicity, national identity, language and religion of the population.","Data a dadansoddiad ar ethnigrwydd, hunaniaeth genedlaethol, iaith a chrefydd y boblogaeth.","Ethnicity, national identity, language and religion","Ethnigrwydd, hunaniaeth genedlaethol, iaith a chrefydd"
LHQ,4,"Data and analysis on the home ownership and renting, labour market participation and educational qualifications.","Data a dadansoddiad ar berchentyaeth a rhentu, cyfranogiad y farchnad lafur a chymwysterau addysgol.","Labour market, housing and qualifications","Marchnad Lafur, Tai a Chymwysterau"
GEO,5,Data and analysis on commuting patterns and characteristics of National Parks and Built-Up Areas,Data a dadansoddiad ar batrymau cymudo a nodweddion parciau cenedlaethol ac ardaloedd adeiledig,Travel to work and other geographic analysis,Teithio i'r gwaith a dadansoddiad daearyddol arall